{
  "artifact_sha256": "76ddace17bc3c751722321925f8f4112324e113e36ee90326ef8f2297bfc703d",
  "environment": {
    "extras": [
      "research"
    ]
  },
  "manifest_version": "1",
  "notes": "Emitted by research/kit/submit.write_repro_manifest from the screening spec; the construction stage replays the recipe with research/kit/rebuild.py and compares fingerprints.",
  "slug": "308-4-30",
  "stages": {
    "certify": {
      "reason": "above the certifier's demonstrated range",
      "status": "not_applicable"
    },
    "circuits": {
      "reason": "the entry has no circuit block",
      "status": "not_applicable"
    },
    "construction": {
      "args": [
        "--constructor",
        "bb.build_bb",
        "--params",
        "{\"l\":14,\"m\":11,\"A_terms\":[[9,9],[8,10],[10,10],[9,5]],\"B_terms\":[[1,7],[9,6],[12,3],[4,1]]}"
      ],
      "budget_seconds": 300,
      "script": "research/kit/rebuild.py",
      "status": "applicable"
    },
    "ler": {
      "reason": "the entry has no measured rate",
      "status": "not_applicable"
    },
    "verify": {
      "status": "applicable"
    }
  }
}
